松山區,建物,臺北市松山區慶城街６７號１６樓,0.0,住,,,1110120,土地0建物1車位0,十六層,17,住宅大樓(11層含以上有電梯),住家用,鋼筋混凝土造,0761230,400.07,4,3,5,有,無,有,168000,420,,0.0,0,含管理費、稅金或水電等費用。；,RPXOMLQLJHHGFDA28CC
南港區,建物,臺北市南港區三重路２２號二樓,0.0,商,,,1110105,土地0建物1車位0,二層,5,公寓(5樓含以下無電梯),住家用,鋼筋混凝土造,0670906,89.59,3,1,1,有,無,有,15000,167,,0.0,0,台北市都市發展局社會住宅包租代管第二期計畫；水電瓦斯費由承租人負擔。,RPRPMLQLJHHGFDA77CC
信義區,建物,臺北市信義區松隆路１０２號５樓之１,0.0,商,,,1110126,土地0建物1車位0,五層,19,辦公商業大樓,商業用,鋼骨造,0801128,175.18,3,2,0,有,有,有,72818,416,,0.0,0,此物件分割53坪出租,RPUPMLQLJHHGFDA08CC
松山區,建物,臺北市松山區富錦街７７巷２弄２６號３樓,0.0,住,,,1110110,土地0建物1車位0,三層,4,公寓(5樓含以下無電梯),住家用,鋼筋混凝土造,0621208,135.41,3,2,2,有,無,有,45000,332,,0.0,0,,RPVPMLQLJHHGFDA18CC
信義區,建物,臺北市信義區信義路五段１１５號１９樓,0.0,其他,,,1110115,土地0建物1車位0,十九層,19,套房(1房1廳1衛),住家用,鋼筋混凝土造,0980702,70.78999999999999,1,1,1,有,有,有,29000,410,,0.0,0,續租。；,RPOQMLQLJHHGFDA57CC
中正區,建物,臺北市中正區衡陽路３０號１樓及２樓,0.0,商,,,1110125,土地0建物1車位0,一層,2,店面(店鋪),,加強磚造,,244.64,0,1,4,有,無,無,150000,613,,0.0,0,,RPRNMLQLJHHGFBA37CC
萬華區,房地(土地+建物),臺北市萬華區中華路一段１５２號,106.64,商,,,1110101,土地0建物1車位0,七層,11,辦公商業大樓,商業用,鋼筋混凝土造,,331.57,0,0,0,無,無,有,145000,437,,0.0,0,,RPQOMLQLJHHGFBA37CC
中正區,房地(土地+建物),臺北市中正區忠孝西路一段１２２號９樓,0.0,商,,,1110115,土地1建物1車位0,九層,10,辦公商業大樓,商業用,鋼筋混凝土造,0640106,108.79,0,0,0,無,無,無,36000,331,,0.0,0,,RPSOMLQLJHHGFBA57CC
大同區,建物,臺北市大同區重慶北路３段５３號,0.0,商,,,1110105,土地0建物1車位0,全,4,透天厝,,加強磚造,,93.72,2,1,1,有,無,有,21000,224,,0.0,0,台北市都發局社會住宅包租代管第三期計畫；水電瓦斯費由承租人負擔。此案為透天厝，本次僅出租第三層。原申報書序號：C1AB11101260013,RPUOMLQLJHHGFBA77CC
士林區,建物,臺北市士林區中山北路七段１４１巷１４弄２號,0.0,住,,,1110114,土地0建物1車位1,一層,5,華廈(10層含以下有電梯),（Ｈ２）集合住宅,鋼筋混凝土造,1100923,246.64,3,2,2,有,無,有,110000,446,坡道平面,0.0,0,,RPUNMLQLJHHGFEA97CC
北投區,建物,臺北市北投區東華街二段３６號四樓之２,0.0,住,,,1101231,土地0建物1車位0,四層,14,住宅大樓(11層含以上有電梯),住家用,鋼筋混凝土造,0970722,190.20000000000002,4,2,2,有,有,有,66000,347,,0.0,0,,RPWNMLQLJHHGFEA18CC
士林區,建物,臺北市士林區建業路３４之８號二樓,0.0,其他,,,1110106,土地0建物1車位0,二層,4,套房(1房1廳1衛),住家用,鋼筋混凝土造,1060405,26.57,1,0,1,有,有,有,13000,489,,0.0,0,台北市都發局社會住宅包租代管第二期計畫；水電瓦斯費及每月管理費1200元由承租人負擔。,RPTOMLQLJHHGFEA97CC
士林區,建物,臺北市士林區建業路３４之２０號二樓,0.0,其他,,,1110106,土地0建物1車位0,二層,4,套房(1房1廳1衛),住家用,鋼筋混凝土造,1060405,25.189999999999998,1,0,1,有,有,有,13000,516,,0.0,0,台北市都發局社會住宅包租代管第二期計畫；水電瓦斯費及每月管理費1200元由承租人負擔。,RPVOMLQLJHHGFEA18CC
士林區,建物,臺北市士林區大東路１５之６號,0.0,商,,,1110113,土地0建物0車位0,二層,3,套房(1房1廳1衛),住家用,加強磚造,0601119,23.46,1,0,1,有,無,有,10000,426,,0.0,0,此為分租套房，第二層共分成3間，一間平均面積約為23.46平方公尺。水雜費＄200、垃圾收取費＄600，由承租人負擔。,RPRPMLQLJHHGFEA87CC
士林區,建物,臺北市士林區中山北路六段１７４號４樓,0.0,住,,,1110121,土地0建物1車位0,四層,4,公寓(5樓含以下無電梯),住家用,鋼筋混凝土造,0640630,102.83,4,1,1,有,無,有,22000,214,,0.0,0,,RPSQMLQLJHHGFEA08CC
大安區,房地(土地+建物),臺北市大安區忠孝東路四段２３３號９樓之１５,0.0,商,,,1110111,土地0建物1車位0,九層,11,住宅大樓(11層含以上有電梯),住家用,鋼筋混凝土造,0711215,38.97,0,1,1,有,有,有,22000,565,,0.0,0,,RPRNMLQLJHHGFFA77CC
大安區,建物,臺北市大安區市民大道三段１８２號１３樓之１,0.0,住,,,1110106,土地0建物1車位2,十三層,23,住宅大樓(11層含以上有電梯),住家用,鋼骨造,1050111,321.67999999999995,3,2,3,有,無,有,200000,622,坡道平面,49.6,0,,RPSNMLQLJHHGFFA87CC
大安區,建物,臺北市大安區永康街８１號５樓,0.0,商,,,1110118,土地0建物1車位0,五層,12,住宅大樓(11層含以上有電梯),住家用,鋼筋混凝土造,1000427,114.61000000000001,2,1,1,有,無,有,82000,715,,0.0,0,,RPTNMLQLJHHGFFA97CC
大安區,建物,臺北市大安區敦化南路二段２６７號地下層,0.0,其他,,,1110119,土地0建物1車位0,地下一層,17,辦公商業大樓,見使用執照,鋼筋混凝土造,0680517,173.56,0,0,0,無,有,無,38000,219,,0.0,0,租金調漲：114年3月1日後租金依當時通膨現況調整，以不超過５％為原則。,RPOOMLQLJHHGFFA57CC
文山區,建物,臺北市文山區木新路二段９號,0.0,住,,,1110119,土地0建物1車位0,見其他登記事項,2,店面(店鋪),商業用,鋼筋混凝土造,0841024,118.28,0,2,2,有,有,無,59000,499,,0.0,0,,RPUNMLQLJHHGFAA57CC
中正區,建物,臺北市中正區重慶南路一段５７號１２樓之９,0.0,商,,,1110120,土地0建物1車位0,十二層,14,辦公商業大樓,見使用執照,鋼筋混凝土造,0910723,46.48,0,0,0,無,無,有,20000,430,,0.0,0,含管理費、稅金或水電等費用。；,RPVNMLQLJHHGFBA87DC
中正區,建物,臺北市中正區和平西路一段１１號七樓,0.0,商,,,1110124,土地0建物0車位0,七層,11,套房(1房1廳1衛),商業用,鋼筋混凝土造,,38.89,1,0,1,有,無,有,14000,360,,0.0,0,,RPSNMLRLJHHGFAA47CC
文山區,建物,臺北市文山區辛亥路四段２２９號四樓,0.0,其他,,,1110101,土地0建物1車位0,四層,5,公寓(5樓含以下無電梯),住家用,鋼筋混凝土造,,78.79,3,2,1,有,無,有,22000,279,,0.0,0,國家住宅及都市更新中心辦理社會住宅包租代管第二期計畫；水電瓦斯費由承租人負擔。,RPTNMLRLJHHGFAA57CC
大安區,建物,臺北市大安區復興南路一段２０５號１０樓,0.0,商,,,1110124,土地0建物1車位0,十層,12,辦公商業大樓,住家用,鋼筋混凝土造,0780201,172.01999999999998,0,0,0,無,有,無,85000,494,,0.0,0,,RPTNMLRLJHHGFFA08CC
大安區,建物,臺北市大安區敦化南路一段１７７巷４６號３樓之２,0.0,住,,,1110122,土地0建物1車位0,三層,8,華廈(10層含以下有電梯),住家用,鋼筋混凝土造,1090309,78.48,1,1,1,有,有,有,58000,739,,0.0,0,含管理費、稅金或水電等費用。；,RPWNMLRLJHHGFFA38CC
大安區,房地(土地+建物),臺北市大安區光復南路６１６號５樓之１,11.27,商,,,1101215,土地1建物1車位0,五層,12,住宅大樓(11層含以上有電梯),商業用,鋼筋混凝土造,0741227,127.96,3,2,2,有,有,有,53000,414,,0.0,0,,RPXNMLRLJHHGFFA48CC
士林區,建物,臺北市士林區天母東路４３巷４弄１２號５樓,0.0,商,,,1110110,土地0建物1車位0,五層,6,華廈(10層含以下有電梯),住家用,鋼筋混凝土造,0850605,180.31,3,2,2,有,有,有,59000,327,,0.0,0,含管理費、稅金或水電等費用。；,RPSNMLRLJHHGFEA87CC
士林區,建物,臺北市士林區社子街８４巷１７號三樓,0.0,住,,,1110125,土地0建物1車位0,三層,4,公寓(5樓含以下無電梯),住家用,鋼筋混凝土造,0660303,77.3,3,2,1,有,無,有,19000,246,,0.0,0,國家住宅及都市更新中心辦理社會住宅包租代管第二期計畫；水電費由承租人負擔。原申報書序號：C1AE11101260030,RPTNMLRLJHHGFEA97CC
士林區,建物,臺北市士林區建業路３４之２０號,0.0,其他,,,1110106,土地0建物1車位0,一層,4,套房(1房1廳1衛),住家用,鋼筋混凝土造,1060405,25.29,1,0,1,有,有,有,13000,514,,0.0,0,台北市都發局社會住宅包租代管第二期計畫；水電瓦斯費及每月管理費1200元由承租人負擔。原序號C1AE11101260018。,RPVNMLRLJHHGFEA18CC
北投區,建物,臺北市北投區吉利街２５９巷２號三樓,0.0,住,,,1110119,土地0建物1車位0,見其他登記事項,4,公寓(5樓含以下無電梯),住家用,鋼筋混凝土造,0651030,119.94,3,2,1,有,無,有,30000,250,,0.0,0,租賃期間含免租金裝潢期。,RPWNMLRLJHHGFEA28CC
士林區,建物,臺北市士林區芝玉路二段５２巷１０號四樓,0.0,住,,,1101230,土地0建物1車位0,四層,5,公寓(5樓含以下無電梯),住家用,鋼筋混凝土造,0750612,113.44,3,2,2,有,無,無,31000,273,,0.0,0,,RPXNMLRLJHHGFEA38CC
北投區,建物,臺北市北投區裕民一路４３號,0.0,商,,,1110126,土地0建物2車位0,見其他登記事項,4,店面(店鋪),住家用,鋼筋混凝土造,0610222,152.19,0,0,0,無,無,無,109227,718,,0.0,0,1一樓租賃面績為部分一層加騎樓約12坪2租金一樓109227含稅、二樓19000未稅,RPOOMLRLJHHGFEA57CC
士林區,建物,臺北市士林區承德路四段３３６號三樓,0.0,住,,,1110122,土地0建物0車位0,三層,5,套房(1房1廳1衛),住家用,鋼筋混凝土造,0700820,38.89,1,0,1,有,無,有,14000,360,,0.0,0,此為分租套房，第3層共分成2間，一間平均面積約為 38.89平方公尺。每月水雜費＄200、垃圾收取費＄600，由承租人負擔。,RPQOMLRLJHHGFEA77CC
北投區,建物,臺北市北投區西安街１段２３３號５樓,0.0,商,,,1110104,土地0建物1車位0,五層,7,華廈(10層含以下有電梯),住家用,鋼筋混凝土造,1000608,75.47,2,1,1,有,有,有,34000,451,,0.0,0,,RPROMLRLJHHGFEA87CC
士林區,建物,臺北市士林區忠誠路２段４８之１號５樓,0.0,住,,,1110108,土地0建物1車位0,五層,17,住宅大樓(11層含以上有電梯),住家用,鋼筋混凝土造,0761116,206.77,4,2,3,有,有,有,54915,266,,0.0,0,,RPSOMLRLJHHGFEA97CC
士林區,建物,臺北市士林區忠誠路１段１６７號６樓,0.0,住,,,1110113,土地0建物1車位0,六層,10,華廈(10層含以下有電梯),住家用,鋼筋混凝土造,0810930,142.39000000000001,4,2,2,有,有,有,56000,393,,0.0,0,,RPTOMLRLJHHGFEA08CC
士林區,建物,臺北市士林區承德路４段１７９巷５號６樓之１,0.0,住,,,1110120,土地0建物1車位1,六層,10,華廈(10層含以下有電梯),住家用,鋼筋混凝土造,0860630,220.18,4,2,3,有,有,有,58000,263,坡道平面,29.54,0,,RPWOMLRLJHHGFEA38CC
士林區,建物,臺北市士林區士東路９１巷４號一樓,0.0,住,,,1110126,土地0建物1車位0,一層,7,華廈(10層含以下有電梯),住家用,鋼筋混凝土造,0750804,124.8,0,0,2,有,無,無,60000,481,,0.0,0,,RPPPMLRLJHHGFEA77CC
士林區,建物,臺北市士林區前街９５號,0.0,住,,,1110125,土地0建物0車位0,全,3,透天厝,住家用,加強磚造,0610520,88.73,1,2,1,有,無,有,25000,282,,0.0,0,部分承租。,RPRPMLRLJHHGFEA97CC
大同區,建物,臺北市大同區市民大道一段２０５號１６樓之３,0.0,其他,,,1110122,土地0建物1車位0,十六層,18,住宅大樓(11層含以上有電梯),住家用,鋼骨造,0980724,92.41,2,2,1,有,有,有,58000,628,,0.0,0,含管理費、稅金或水電等費用。；,RPXNMLRLJHHGFBA08CC
大同區,建物,臺北市大同區哈密街４５巷１弄４之１號三樓,0.0,住,,,1110126,土地0建物1車位0,三層,4,公寓(5樓含以下無電梯),住家用,加強磚造,0551201,72.63,2,1,1,有,無,有,20500,282,,0.0,0,國家住宅及都市更新中心辦理社會住宅包租代管第二期計畫；水電瓦斯費由承租人負擔。,RPVOMLRLJHHGFBA97CC
南港區,建物,臺北市南港區東新街１６８巷２０號６樓,0.0,住,,,1110108,土地0建物1車位0,六層,11,住宅大樓(11層含以上有電梯),住家用,鋼筋混凝土造,1010314,70.28999999999999,2,1,1,有,有,有,24000,341,,0.0,0,,RPTNMLRLJHHGFDA87CC
信義區,建物,臺北市信義區松山路４２１號三樓之１,0.0,住,,,1110104,土地0建物1車位0,三層,17,住宅大樓(11層含以上有電梯),住家用,鋼骨鋼筋混凝土造,0820514,78.63,2,1,1,有,有,有,28000,356,,0.0,0,,RPUNMLRLJHHGFDA97CC
南港區,建物,臺北市南港區重陽路４８２號１樓,0.0,住,,,1110127,土地0建物1車位0,一層,15,住宅大樓(11層含以上有電梯),日常用品零售業（Ｇ３）（含便利商店）,鋼筋混凝土造,1050411,63.88,0,1,1,有,有,無,35000,548,,0.0,0,含管理費2000元,RPQOMLRLJHHGFDA67CC
松山區,建物,臺北市松山區光復北路２３０巷３３號６樓,0.0,住,,,1110119,土地0建物1車位0,六層,18,住宅大樓(11層含以上有電梯),集合住宅,鋼筋混凝土造,0910514,129.10999999999999,3,2,1,有,有,有,38000,294,,0.0,0,,RPROMLRLJHHGFDA77CC
信義區,建物,臺北市信義區松德路１８０巷９號６樓,0.0,其他,,,1110125,土地0建物1車位0,六層,7,華廈(10層含以下有電梯),住家用,鋼筋混凝土造,0780718,142.13,4,2,2,有,有,有,46500,327,,0.0,0,,RPSOMLRLJHHGFDA87CC
信義區,車位,臺北市信義區基隆路１段１７６號停車位,0.0,住,,,1110113,土地0建物0車位1,,0,其他,停車空間,鋼筋混凝土造,0810125,250.76,0,0,0,有,無,無,5000,,坡道平面,41.79,5000,本建物共六個車位總登記坪數75.86坪，本案出租一個車位約12.64坪,RPQPMLRLJHHGFDA77CC
松山區,車位,臺北市松山區敦化南路一段３號,0.0,,,,1101230,土地0建物0車位1,,,其他,,,,33.28,0,0,0,有,無,有,10000,,坡道平面,33.28,10000,,RPUPMLRLJHHGFDA18CC
松山區,建物,臺北市松山區八德路四段７６０號八樓之１,0.0,商,,,1101215,土地0建物1車位4,八層,16,辦公商業大樓,商業用,見使用執照,0880702,680.61,4,1,0,有,有,無,291760,429,坡道平面,124.24,0,,RPPQMLRLJHHGFDA77CC
內湖區,建物,臺北市內湖區成功路三段７８號,0.0,商,,,1110126,土地0建物1車位0,一層,5,公寓(5樓含以下無電梯),見使用執照,鋼筋混凝土造,0690624,125.85,0,0,0,無,無,無,60000,477,,0.0,0,租金不含稅 不含水.電.瓦斯.電話費.社區大樓管理費.清潔費,RPQNMLRLJHHGFCA47CC
中山區,建物,臺北市中山區農安街２４號２樓,0.0,商,,,1110121,土地0建物0車位0,二層,4,套房(1房1廳1衛),住家用,鋼筋混凝土造,0621012,23.33,1,0,1,有,無,有,14000,600,,0.0,0,此為分租套房，第2層共分成4間，一間平均面積約為 23.33平方公尺。每月水雜費＄200，垃圾收取費＄600，由承租人負擔。,RPPOMLRLJHHGFCA47CC
中山區,建物,臺北市中山區新生北路一段３１號,0.0,住,,,1110122,土地0建物0車位0,四層,4,公寓(5樓含以下無電梯),,加強磚造,,34.99,2,1,1,有,無,有,14000,400,,0.0,0,此為2房以上，第4層共分成2間，一間平均面積約為 34.99平方公尺。每月水雜費＄200、垃圾收取費＄900，由承租人負擔。,RPQOMLRLJHHGFCA57CC
中山區,房地(土地+建物),臺北市中山區民權西路９巷２２號４樓之１,0.0,商,,,1110119,土地0建物1車位0,四層,14,其他,一般事務所,鋼筋混凝土造,1011112,52.769999999999996,1,1,1,有,有,有,26500,502,,0.0,0,,RPVOMLRLJHHGFCA08CC
中山區,建物,臺北市中山區復興北路１９０巷２５號１３樓,0.0,住,,,1110116,土地0建物1車位0,十三層,15,住宅大樓(11層含以上有電梯),集合住宅,鋼筋混凝土造,0750609,92.32000000000001,2,2,1,有,有,有,45000,487,,0.0,0,,RPXOMLRLJHHGFCA28CC
中山區,建物,臺北市中山區中山北路３段２６之１號,0.0,商,,,1110125,土地0建物1車位0,一層,12,店面(店鋪),商業用,鋼筋混凝土造,0700820,100.33,0,0,0,無,有,有,75000,748,,0.0,0,,RPOPMLRLJHHGFCA47CC
內湖區,建物,臺北市內湖區星雲街１６８巷４３號１１樓之２,0.0,住,,,1110119,土地0建物1車位0,十一層,21,住宅大樓(11層含以上有電梯),住家用,鋼筋混凝土造,0860124,59.129999999999995,1,1,1,有,有,有,25000,423,,0.0,0,,RPPPMLRLJHHGFCA57CC
內湖區,建物,臺北市內湖區金龍路６７巷１０號二樓,0.0,住,,,1110125,土地0建物1車位1,二層,12,住宅大樓(11層含以上有電梯),集合住宅,鋼筋混凝土造,1100806,174.97,3,2,2,有,有,有,45000,257,坡道平面,39.72,0,,RPQPMLRLJHHGFCA67CC
中山區,建物,臺北市中山區建國北路１段５０巷２５號３樓,0.0,商,,,1110119,土地0建物1車位1,三層,7,華廈(10層含以下有電梯),住家用,鋼筋混凝土造,1070501,120.75,2,1,1,有,有,有,55000,455,塔式車位,19.96,0,,RPSPMLRLJHHGFCA87CC
內湖區,建物,臺北市內湖區內湖路一段４９號三樓,0.0,住,,,1110120,土地0建物0車位0,三層,5,公寓(5樓含以下無電梯),住家用,鋼筋混凝土造,0780920,60.45,2,1,1,有,無,有,28500,471,,0.0,0,,RPVPMLRLJHHGFCA18CC
中山區,房地(土地+建物),臺北市中山區長安東路２段１６８號４樓,57.25,商,,,1101022,土地1建物1車位0,四層,4,公寓(5樓含以下無電梯),,加強磚造,,148.99,4,4,4,有,無,有,69000,463,,0.0,0,,RPWPMLRLJHHGFCA28CC
中山區,建物,臺北市中山區樂群三路１２６號１３樓,0.0,商,,,1101208,土地0建物1車位5,十三層,17,辦公商業大樓,一般事務所,鋼骨造、鋼骨鋼筋混凝土造,1081216,727.91,0,0,0,無,有,無,397468,546,坡道平面,0.0,0,,RPVQMLRLJHHGFCA28CC
中山區,建物,臺北市中山區樂群三路１２８號１３樓,0.0,商,,,1101208,土地0建物1車位5,十三層,17,辦公商業大樓,一般事務所,鋼骨造、鋼骨鋼筋混凝土造,1081216,675.49,0,0,0,無,有,無,362880,537,坡道平面,0.0,0,,RPWQMLRLJHHGFCA38CC
中山區,建物,臺北市中山區樂群三路１３２號１３樓,0.0,商,,,1101208,土地0建物1車位5,十三層,17,辦公商業大樓,一般事務所,鋼骨造、鋼骨鋼筋混凝土造,1081216,659.51,0,0,0,無,有,無,352674,535,坡道平面,0.0,0,,RPXQMLRLJHHGFCA48CC
中山區,建物,臺北市中山區樂群三路１３０號１３樓,0.0,商,,,1101208,土地0建物1車位5,十三層,17,辦公商業大樓,一般事務所,鋼骨造、鋼骨鋼筋混凝土造,1081216,712.02,0,0,0,無,有,無,386978,543,坡道平面,0.0,0,,RPORMLRLJHHGFCA67CC
中山區,建物,臺北市中山區錦西街８號四樓,0.0,住,,,1110126,土地0建物0車位0,四層,7,華廈(10層含以下有電梯),住家用,鋼筋混凝土造,0670502,36.98,2,1,1,有,無,有,19500,527,,0.0,0,此為2房，第4層共分為10間，一間平均面積約為36.98平方公尺；水雜費200元、垃圾收取費900元由承租人負擔。原申報書序號：C1AC11101270043,RPURMLRLJHHGFCA28CC
中山區,建物,臺北市中山區民權東路３段３７號８樓,0.0,商,,,1101229,土地0建物2車位0,八層,16,辦公商業大樓,商業用,鋼筋混凝土造,0790301,506.35,4,1,0,有,有,有,260100,514,,0.0,0,,RPPNMLSLJHHGFCA47CC
中山區,建物,臺北市中山區建國北路一段１２６號８樓,0.0,住,,,1110112,土地0建物1車位2,八層,9,辦公商業大樓,商業用,鋼筋混凝土造,0850727,717.9300000000001,6,1,1,有,無,有,325800,454,坡道平面,0.0,0,,RPQNMLSLJHHGFCA57CC
中山區,建物,臺北市中山區長安東路二段１８４號五樓之１,0.0,商,,,1110125,土地0建物1車位0,五層,12,辦公商業大樓,商業用,鋼筋混凝土造,0720204,174.31,2,1,1,有,有,有,55000,316,,0.0,0,,RPSNMLSLJHHGFCA77CC
中山區,建物,臺北市中山區長安東路二段１１２號６樓之３,0.0,商,,,1110119,土地0建物1車位0,六層,12,住宅大樓(11層含以上有電梯),商業用,鋼筋混凝土造,0740528,132.6,2,1,1,有,有,無,52000,392,,0.0,0,,RPUNMLSLJHHGFCA97CC
中山區,建物,臺北市中山區中山北路一段５３巷２６號５樓之３,0.0,商,,,1110117,土地0建物1車位0,五層,10,住宅大樓(11層含以上有電梯),住家用,鋼筋混凝土造,0971030,56.92,0,0,0,無,有,有,29000,509,,0.0,0,續租。；,RPPOMLSLJHHGFCA57CC
中山區,建物,臺北市中山區復興北路４８號１１樓之１,0.0,商,,,1110128,土地0建物1車位0,十一層,11,辦公商業大樓,商業用,鋼筋混凝土造,0651102,47.03,1,0,2,有,有,有,25000,532,,0.0,0,,RPPPMLSLJHHGFCA67CC
中山區,建物,臺北市中山區吉林路３９３巷２５號三樓,0.0,住,,,1110120,土地0建物1車位0,三層,4,公寓(5樓含以下無電梯),住家用,鋼筋混凝土造,0610910,80.34,3,2,1,有,無,有,26000,324,,0.0,0,,RPQPMLSLJHHGFCA77CC
中山區,建物,臺北市中山區中山北路２段６５巷１０號９樓之５,0.0,商,,,1110110,土地0建物1車位0,九層,12,住宅大樓(11層含以上有電梯),住家用,鋼筋混凝土造,1090428,112.65,2,1,2,有,有,有,81600,724,,0.0,0,含管理費、稅金或水電等費用。；,RPSPMLSLJHHGFCA97CC
中山區,建物,臺北市中山區中山北路２段６５巷１０號１０樓之５,0.0,商,,,1110119,土地0建物1車位0,十層,12,套房(1房1廳1衛),住家用,鋼筋混凝土造,1090428,60.28,1,1,1,有,有,有,50000,829,,0.0,0,含管理費、稅金或水電等費用。；,RPOQMLSLJHHGFCA67CC
中山區,建物,臺北市中山區新生北路二段６０巷２號九樓之２,0.0,商,,,1110121,土地0建物1車位0,九層,12,住宅大樓(11層含以上有電梯),住家用,鋼筋混凝土造,0701228,57.7,2,1,1,有,有,有,19800,343,,0.0,0,國家住宅及都市更新中心辦理社會住宅包租代管第三期計畫；水電瓦斯費及每月管理費1100元由承租人負擔。,RPTQMLSLJHHGFCA18CC
內湖區,建物,臺北市內湖區東湖路４３巷９號四樓,0.0,商,,,1110125,土地0建物1車位0,四層,5,公寓(5樓含以下無電梯),商業用,鋼筋混凝土造,0760207,104.0,3,2,2,有,無,有,26000,250,,0.0,0,國家住宅及都市更新中心辦理社會住宅包租代管第三期計畫；水電瓦斯費由承租人負擔。,RPVQMLSLJHHGFCA38CC
中山區,建物,臺北市中山區民權東路三段１３號三樓,0.0,商,,,1110119,土地0建物0車位0,三層,4,套房(1房1廳1衛),住家用,鋼筋混凝土造,0640310,30.0,1,0,1,有,無,有,12500,417,,0.0,0,此為分租套房，第3層共分成 3間，一間平均面積約為 30平方公尺。每月水雜費＄200，垃圾收取費 ＄600，由承租人負擔。,RPWQMLSLJHHGFCA48CC
內湖區,建物,臺北市內湖區康寧路三段９９巷３９弄７２號二樓,0.0,住,,,1110125,土地0建物1車位1,二層,7,華廈(10層含以下有電梯),住家用,鋼筋混凝土造,0820426,105.22,2,2,1,有,有,有,28000,266,坡道機械,0.0,0,國家住宅及都市更新中心辦理社會住宅包租代管第三期計畫；水電瓦斯費及每月管理費2205元與停車位管理費2000元由承租人負擔。原申報序號：C1AC11101280039,RPRRMLSLJHHGFCA08CC
信義區,房地(土地+建物),臺北市信義區基隆路一段１０１巷１號６樓,0.0,商,,,1110117,土地0建物1車位0,六層,14,住宅大樓(11層含以上有電梯),集合住宅,鋼筋混凝土造,1041118,160.69,3,2,2,有,有,有,65000,405,,0.0,0,含管理費、稅金或水電等費用。；,RPSNMLSLJHHGFDA87CC
信義區,建物,臺北市信義區基隆路一段１４７巷５弄３號,0.0,住,,,1110127,土地0建物1車位0,一層,4,店面(店鋪),住家用,鋼筋混凝土造,0640513,101.14,0,0,1,有,無,無,80000,791,,0.0,0,,RPTNMLSLJHHGFDA97CC
松山區,建物,臺北市松山區寶清街８９巷３５號１樓,0.0,住,,,1110127,土地0建物1車位0,一層,7,店面(店鋪),商業用,鋼筋混凝土造,0701221,56.21,0,0,1,有,無,無,27000,480,,0.0,0,,RPPOMLSLJHHGFDA67CC
松山區,建物,臺北市松山區八德路三段１６４號七樓之１２,0.0,住,,,1110121,土地0建物1車位0,七層,12,套房(1房1廳1衛),住家用,鋼筋混凝土造,0781023,38.99,1,1,1,有,有,有,21000,539,,0.0,0,租金含管理費。,RPSOMLSLJHHGFDA97CC
松山區,建物,臺北市松山區八德路四段８０１號四樓,0.0,商,,,1110127,土地0建物0車位0,四層,4,套房(1房1廳1衛),住家用,鋼筋混凝土造,0610802,22.43,1,0,1,有,無,有,11500,513,,0.0,0,此為分租套房，第4層共分為4間，一間平均面積約為22.43平方公尺；水雜費200元、垃圾收取費600元由承租人負擔。,RPWOMLSLJHHGFDA38CC
南港區,建物,臺北市南港區忠孝東路六段４９１號三樓,0.0,工,,,1110122,土地0建物0車位0,三層,4,套房(1房1廳1衛),工業用,鋼筋混凝土造,0670120,33.54,1,0,1,有,無,有,13000,388,,0.0,0,此為分租套房，第3層共分為17間，一間平均面積約為33.54平方公尺；水雜費200元、垃圾收取費600元由承租人負擔。,RPXOMLSLJHHGFDA48CC
大同區,建物,臺北市大同區太原路８０號６樓之１,0.0,商,,,1110112,土地0建物1車位0,六層,14,住宅大樓(11層含以上有電梯),住家用,鋼筋混凝土造,0971211,68.85,1,1,1,有,無,有,26800,389,,0.0,0,,RPRNMLSLJHHGFBA57CC
大同區,建物,臺北市大同區南京西路５７號６樓之１,0.0,其他,,,1100114,土地0建物1車位0,六層,19,住宅大樓(11層含以上有電梯),住家用,鋼筋混凝土造,1080304,103.85,2,2,1,有,有,有,65000,626,,0.0,0,續租。；含管理費、稅金或水電等費用。；,RPUNMLSLJHHGFBA87CC
大同區,建物,臺北市大同區承德路三段２０８巷４９號四樓,0.0,住,,,1110122,土地0建物1車位0,四層,7,華廈(10層含以下有電梯),住家用,鋼筋混凝土造,0720630,105.67,3,2,2,有,有,有,40000,379,,0.0,0,第二年租金優惠，租金每個月新台幣參萬捌仟元整。,RPWNMLSLJHHGFBA08CC
