內湖區,車位,臺北市內湖區文湖街２１巷６８弄１３號等,0.0,住,,,1101207,土地0建物0車位1,,,其他,,,,57.89,0,0,0,有,有,無,3000,,升降平面,0.0,3000,,RPVPMLKMKIGGFCA67CC
內湖區,建物,臺北市內湖區瑞光路２２３號３樓,0.0,住,,,1101220,土地0建物1車位0,三層,8,華廈(10層含以下有電梯),住家用,鋼筋混凝土造,0831108,153.92,3,2,2,有,有,無,35000,227,,0.0,0,,RPXPMLKMKIGGFCA87CC
中山區,建物,臺北市中山區新生北路二段６６號６樓之１９,0.0,商,,,1101224,土地0建物1車位0,十二層,12,住宅大樓(11層含以上有電梯),商業用,鋼筋混凝土造,0690721,24.599999999999998,1,1,1,有,有,有,13000,528,,0.0,0,含管理費,RPVQMLKMKIGGFCA77CC
中山區,建物,臺北市中山區中山北路１段１０５巷１２號４樓之１,0.0,商,,,1101220,土地0建物1車位0,四層,10,華廈(10層含以下有電梯),一般事務所,鋼筋混凝土造,1060110,115.58000000000001,2,2,2,有,有,有,74800,647,,0.0,0,續租。；含管理費、稅金或水電等費用。；,RPWQMLKMKIGGFCA87CC
中山區,房地(土地+建物),臺北市中山區明水路６３６號九樓,11.4,商,,,1101230,土地1建物1車位0,九層,9,華廈(10層含以下有電梯),商業用,鋼筋混凝土造,0960503,47.85,1,1,1,有,無,有,27500,575,,0.0,0,,RPXQMLKMKIGGFCA97CC
中山區,建物,臺北市中山區農安街８號６樓之８,0.0,商,,,1101213,土地0建物1車位0,六層,14,住宅大樓(11層含以上有電梯),商業用,鋼筋混凝土造,0980622,43.769999999999996,2,1,1,有,有,有,50000,1142,,0.0,0,續租。；含管理費、稅金或水電等費用。；,RPORMLKMKIGGFCA17CC
中山區,建物,臺北市中山區吉林路３６９號２樓之６,0.0,住,,,1101206,土地0建物0車位0,二層,7,套房(1房1廳1衛),住家用,鋼筋混凝土造,0681219,20.43,1,0,1,有,無,有,12200,597,,0.0,0,此為分租套房，第二層共分成4間，一間平均面積約為20.43平方公尺，垃圾收取費600元、水雜費200元，皆為承租人負擔。,RPRRMLKMKIGGFCA47CC
中山區,建物,臺北市中山區民生東路一段２６號７樓之６,0.0,商,,,1101214,土地0建物1車位0,六層,12,住宅大樓(11層含以上有電梯),商業用,鋼筋混凝土造,0951012,40.22,1,1,2,有,有,有,34000,845,,0.0,0,,RPTRMLKMKIGGFCA67CC
中山區,建物,臺北市中山區敬業三路１６２巷１３６號５樓,0.0,住,,,1101229,土地0建物1車位1,五層,12,住宅大樓(11層含以上有電梯),住家用,鋼筋混凝土造,0890628,142.82999999999998,2,2,1,有,有,有,45000,315,坡道平面,0.0,0,,RPURMLKMKIGGFCA77CC
中山區,建物,臺北市中山區吉林路３６９號２樓,0.0,住,,,1101210,土地0建物0車位0,二層,7,套房(1房1廳1衛),住家用,鋼筋混凝土造,0681219,22.96,1,0,1,有,無,有,12200,531,,0.0,0,此為分租套房，第2層共分成4間，一間平均面積約22.96為平方公尺。每月水雜費＄200，垃圾收取費＄600，由承租人負擔,RPOSMLKMKIGGFCA27CC
士林區,房地(土地+建物)+車位,臺北市士林區中山北路六段２巷５２號７樓,311.01,住,,,1100715,土地1建物1車位1,七層,7,華廈(10層含以下有電梯),住家用,鋼筋混凝土造,0740613,327.32,4,2,2,有,有,無,152000,464,坡道平面,16.31,0,,RPPNMLKMKIGGFEA07CC
士林區,建物,臺北市士林區新安路１２０號,0.0,住,,,1101210,土地0建物1車位0,全,2,透天厝,住家用,加強磚造,0680720,354.09,7,3,5,有,無,有,175000,494,,0.0,0,,RPTOMLKMKIGGFEA57CC
士林區,建物,臺北市士林區延平北路六段１７６巷５弄１０號三樓,0.0,住,,,1101227,土地0建物1車位0,三層,3,公寓(5樓含以下無電梯),住家用,加強磚造,0580129,88.5,3,1,1,有,無,有,14000,158,,0.0,0,國家住宅及都市更新中心110年社會住宅包租代管第三期計畫,RPWOMLKMKIGGFEA87CC
北投區,建物,臺北市北投區石牌路二段３４３巷２２號五樓,0.0,住,,,1101227,土地0建物1車位0,五層,6,華廈(10層含以下有電梯),住家用,鋼筋混凝土造,0871001,50.33,1,1,2,有,有,有,30000,596,,0.0,0,國家住宅及都市更新中心110年社會住宅包租代管第三期計畫,RPTPMLKMKIGGFEA67CC
士林區,建物,臺北市士林區中山北路六段２９０巷２３弄１０號五樓,0.0,住,,,1101229,土地0建物1車位0,五層,5,公寓(5樓含以下無電梯),住家用,鋼筋混凝土造,0690812,121.25,3,2,2,有,無,有,32000,264,,0.0,0,國家住宅及都市更新中心108年社會住宅包租代管第二期計畫,RPPQMLKMKIGGFEA37CC
士林區,建物,臺北市士林區德行西路４５號六樓之一及４５之一號六樓之一,0.0,工,,,1101013,土地0建物1車位0,六層,9,辦公商業大樓,工業用,鋼筋混凝土造,0821230,191.12,3,1,0,有,無,有,75000,392,,0.0,0,,RPTQMLKMKIGGFEA77CC
士林區,建物,臺北市士林區忠誠路一段１６巷２２弄１２號５樓之１,0.0,住,,,1101215,土地0建物1車位0,五層,7,華廈(10層含以下有電梯),住家用,鋼筋混凝土造,0980513,199.45999999999998,3,2,2,有,有,有,75000,376,,0.0,0,,RPORMLKMKIGGFEA37CC
士林區,房地(土地+建物),臺北市士林區中山北路七段１４１巷１５號地下１樓,29.88,住,,,1101229,土地1建物1車位0,地下一層,5,公寓(5樓含以下無電梯),見使用執照,鋼筋混凝土造,0680922,117.81,3,1,2,有,無,無,31289,266,,0.0,0,,RPRRMLKMKIGGFEA67CC
士林區,建物,臺北市士林區中山北路六段１０號７樓之１,0.0,住,,,1101216,土地0建物1車位0,七層,8,華廈(10層含以下有電梯),住家用,鋼筋混凝土造,0870721,91.64000000000001,3,2,1,有,有,有,50000,546,,0.0,0,,RPSRMLKMKIGGFEA77CC
士林區,建物,臺北市士林區中山北路六段７７６巷８２號地下一層,0.0,住,,,1101227,土地0建物1車位0,地下一層,7,店面(店鋪),商業用,鋼筋混凝土造,0790521,388.81,0,0,2,有,無,無,100000,257,,0.0,0,,RPTRMLKMKIGGFEA87CC
萬華區,建物,臺北市萬華區萬大路４８６巷５９弄１２號４樓,0.0,住,,,1101229,土地0建物1車位0,四層,5,公寓(5樓含以下無電梯),住家用,鋼筋混凝土造,0700625,66.49,2,1,1,有,無,無,15000,226,,0.0,0,,RPQNMLKMKIGGFBA86CC
萬華區,建物,臺北市萬華區青年路３０巷１０號四樓,0.0,住,,,1101219,土地0建物1車位0,四層,12,住宅大樓(11層含以上有電梯),住家用,鋼筋混凝土造,0760316,104.72999999999999,3,2,2,有,有,有,24000,229,,0.0,0,,RPTNMLKMKIGGFBA17CC
大同區,建物,臺北市大同區南京西路２８８號１３樓,0.0,商,,,1101217,土地0建物1車位0,十三層,19,住宅大樓(11層含以上有電梯),一般事務所,鋼筋混凝土造,1011214,165.2,4,2,2,有,無,有,70000,424,,0.0,0,,RPUNMLKMKIGGFBA27CC
萬華區,建物,臺北市萬華區昆明街１１１號五樓之１,0.0,商,,,1101228,土地0建物1車位0,五層,14,住宅大樓(11層含以上有電梯),見使用執照,鋼筋混凝土造,0920122,27.26,1,0,1,有,有,有,15000,550,,0.0,0,國家住宅及都市更新中心110年社會住宅包租代管第三期計畫,RPVNMLKMKIGGFBA37CC
萬華區,建物,臺北市萬華區康定路２０號十三樓之３,0.0,商,,,1101223,土地0建物1車位0,十三層,14,住宅大樓(11層含以上有電梯),見使用執照,鋼筋混凝土造,0900705,34.06,1,1,1,有,有,有,16500,484,,0.0,0,國家住宅及都市更新中心110年社會住宅包租代管第三期計畫,RPXNMLKMKIGGFBA57CC
大同區,建物,臺北市大同區大龍街９４號四樓之１,0.0,商,,,1101228,土地0建物1車位0,四層,5,公寓(5樓含以下無電梯),住家用,鋼筋混凝土造,0640723,46.89,1,0,1,有,無,有,15000,320,,0.0,0,國家住宅及都市更新中心110年社會住宅包租代管第三期計畫,RPROMLKMKIGGFBA07CC
萬華區,建物,臺北市萬華區青年路５６號１樓之４,0.0,住,,,1101230,土地0建物1車位0,一層,12,住宅大樓(11層含以上有電梯),住家用,鋼筋混凝土造,0711027,54.019999999999996,2,1,1,有,有,無,19000,352,,0.0,0,,RPSPMLKMKIGGFBA27CC
大同區,建物,臺北市大同區承德路一段２４巷１７號,0.0,商,,,1101214,土地0建物0車位0,三層,4,套房(1房1廳1衛),,加強磚造,,23.85,1,0,1,有,無,有,12700,532,,0.0,0,此為分租套房，第3層共分成5間，一間平均面積約23.85為平方公尺。每月水雜費＄200，垃圾收取費＄600，由承租人負擔,RPVPMLKMKIGGFBA57CC
文山區,建物,臺北市文山區新光路一段１４３號,0.0,住,,,1101214,土地0建物1車位0,一層,15,店面(店鋪),一般零售業甲組,鋼筋混凝土造,0950718,340.15,0,0,0,無,無,無,90000,265,,0.0,0,,RPROMLKMKIGGFAA96CC
大安區,建物,臺北市大安區永康街７５巷１７之１號３樓,0.0,住,,,1101216,土地0建物1車位0,三層,7,華廈(10層含以下有電梯),住家用,鋼筋混凝土造,0901026,146.07,3,2,2,有,有,有,45000,308,,0.0,0,,RPOPMLKMKIGGFFA27CC
大安區,建物,臺北市大安區信義路４段２５６號９樓之２,0.0,商,,,1101201,土地0建物1車位0,九層,15,住宅大樓(11層含以上有電梯),住家用,鋼筋混凝土造,0711106,96.98,2,2,1,有,有,有,40000,412,,0.0,0,,RPPPMLKMKIGGFFA37CC
大同區,建物,臺北市大同區市民大道一段２０３號７樓-１６,0.0,其他,,,1101224,土地0建物1車位0,七層,18,住宅大樓(11層含以上有電梯),住家用,鋼骨造,0980724,91.13,2,1,1,有,有,有,68000,746,,0.0,0,續租。；含管理費、稅金或水電等費用。；,RPPNMLLMKIGGFBA86CC
大同區,建物,臺北市大同區南京西路２５巷３２號六樓之１,0.0,商,,,1101215,土地0建物1車位0,六層,7,華廈(10層含以下有電梯),住家用,鋼筋混凝土造,0970626,99.72999999999999,2,1,1,有,無,有,42000,421,,0.0,0,含管理費、稅金或水電等費用。；,RPQNMLLMKIGGFBA96CC
北投區,建物,臺北市北投區裕民二路７５號八樓,0.0,商,,,1101231,土地0建物1車位0,八層,19,辦公商業大樓,自由業事務所,鋼筋混凝土造,1021108,133.35,3,2,2,有,有,有,71500,536,,0.0,0,續租。；含管理費、稅金或水電等費用。；,RPRNMLLMKIGGFEA37CC
士林區,建物,臺北市士林區芝玉路一段２２６號九樓之２,0.0,住,,,1101210,土地0建物1車位1,九層,18,住宅大樓(11層含以上有電梯),住家用,鋼骨鋼筋混凝土造,0971112,242.42000000000002,3,2,2,有,有,有,90000,371,坡道平面,0.0,0,續租。；含管理費、稅金或水電等費用。；,RPSNMLLMKIGGFEA47CC
中山區,建物,臺北市中山區新生北路二段３８號八樓之５,0.0,商,,,1101231,土地0建物1車位0,八層,17,辦公商業大樓,商業用,鋼筋混凝土造,0850718,78.9,2,1,1,有,有,有,30000,380,,0.0,0,續租。；含管理費、稅金或水電等費用。；,RPPNMLLMKIGGFCA96CC
中山區,建物,臺北市中山區民權東路三段４６號九樓之１,0.0,商,,,1101222,土地0建物1車位0,九層,15,住宅大樓(11層含以上有電梯),住家用,鋼筋混凝土造,0731109,123.47,2,1,2,有,有,有,62430,506,,0.0,0,含管理費、稅金或水電等費用。；,RPQNMLLMKIGGFCA07CC
中山區,建物,臺北市中山區天祥路８０號４樓之３,0.0,商,,,1101231,土地0建物1車位0,四層,14,住宅大樓(11層含以上有電梯),住家用,鋼筋混凝土造,0931203,54.769999999999996,1,1,1,有,有,有,23000,420,,0.0,0,,RPPNMLMJJHHGFCA66CC
中山區,車位,臺北市中山區新生北路二段６８巷１３號地下室B３-３６號車位,1.11,商,,,1110101,土地0建物0車位1,,0,其他,商業用,鋼筋混凝土造,0970813,13.07,0,0,0,有,有,無,3000,,升降機械,13.07,3000,,RPQNMLMJJHHGFCA76CC
中山區,建物,臺北市中山區民權東路二段９６號,0.0,商,,,1101230,土地0建物1車位0,全,3,透天厝,,加強磚造,,165.04,4,0,0,有,無,有,46000,279,,0.0,0,含增建或未登記建物。；租：二樓、三樓及四樓加蓋部份,RPOPMLNJJHHGFCA86CC
中山區,建物,臺北市中山區中山北路一段１１號１４樓,0.0,商,,,1101210,土地0建物0車位0,十四層,18,辦公商業大樓,商業用,鋼骨鋼筋混凝土造,0860630,284.31,2,0,0,有,有,無,180600,635,,0.0,0,本戶承租部份面積含公設約86坪,RPSRMLNJJHHGFCA47CC
中山區,建物,臺北市中山區龍江路２３號五樓,0.0,商,,,1101228,土地0建物1車位2,五層,10,辦公商業大樓,商業用,鋼筋混凝土造,0780501,471.02,8,0,0,有,有,有,262500,557,升降機械,0.0,0,,RPTRMLNJJHHGFCA57CC
中山區,建物,臺北市中山區復興北路１７８號十二樓之１１,0.0,商,,,1101226,土地0建物1車位0,十二層,16,辦公商業大樓,商業用,鋼筋混凝土造,0851205,53.75,1,2,1,有,有,有,26000,484,,0.0,0,,RPUSMLNJJHHGFCA77CC
北投區,建物,臺北市北投區石牌路二段３４９號１樓,0.0,住,,,1101231,土地0建物1車位0,全,2,透天厝,住家用,加強磚造,0560203,98.62,0,0,0,無,無,無,50000,507,,0.0,0,,RPPOMLNJJHHGFEA07CC
北投區,建物,臺北市北投區同德街２號四樓之１,0.0,住,,,1101222,土地0建物1車位0,四層,15,住宅大樓(11層含以上有電梯),自由職業事務所（不含文化藝術工作室）,鋼筋混凝土造,0940923,59.05,2,1,2,有,有,有,37000,627,,0.0,0,續租。；,RPQPMLNJJHHGFEA27CC
萬華區,建物,臺北市萬華區桂林路１０７號１１樓,0.0,商,,,1101221,土地0建物1車位0,十一層,24,住宅大樓(11層含以上有電梯),住家用,鋼筋混凝土造,1081008,89.43,2,1,1,有,有,有,28000,313,,0.0,0,,RPPOMLNJJHHGFBA76CC
萬華區,建物,臺北市萬華區西園路二段３１８號,0.0,住,,,1101222,土地0建物0車位0,三層,3,套房(1房1廳1衛),住家用,加強磚造,0551222,35.66,1,0,1,有,無,有,12200,342,,0.0,0,此為分租套房，第三層共分成3間，一間平均面積約為35.66平方公尺。每月水雜費＄200，垃圾收取費＄600，由承租人負擔,RPOOMLOJJHHGFBA76CC
大同區,建物,臺北市大同區哈密街５９巷３８弄４９號十二樓,0.0,其他,,,1101217,土地0建物1車位0,十二層,13,住宅大樓(11層含以上有電梯),多戶住宅（Ｈ２）集合住宅,鋼筋混凝土造,1081105,155.91,3,2,2,有,有,有,40000,257,,0.0,0,租金含管理費。,RPQOMLOJJHHGFBA96CC
中正區,建物,臺北市中正區仁愛路二段３８巷６弄５號,0.0,住,,,1101230,土地0建物1車位0,一層,4,公寓(5樓含以下無電梯),住家用,鋼筋混凝土造,0590107,47.37,2,1,1,有,無,無,18000,380,,0.0,0,含增建或未登記建物。；,RPSOMLOJJHHGFBA17CC
中正區,建物,臺北市中正區杭州南路一段７７巷９之１號四樓,0.0,住,,,1101224,土地0建物1車位0,四層,4,公寓(5樓含以下無電梯),,加強磚造,0560905,98.06,3,2,1,有,無,有,34000,347,,0.0,0,,RPOPMLOJJHHGFBA86CC
大同區,建物,臺北市大同區重慶北路三段５３號４樓,0.0,商,,,1101206,土地0建物1車位0,四層,4,公寓(5樓含以下無電梯),,加強磚造,,93.72,2,1,1,有,無,有,22000,235,,0.0,0,台北市都發局社會住宅包租代管第2期計畫,RPQPMLOJJHHGFBA07CC
大同區,建物,臺北市大同區長安西路１４５巷３５號２樓,0.0,商,,,1101215,土地0建物0車位0,二層,4,套房(1房1廳1衛),住家用,鋼筋混凝土造,0640724,24.52,1,0,1,有,無,有,12200,498,,0.0,0,此為分租套房，第2層共分成4間，一間平均面積約為24.52平方公尺。每月水雜費＄200，垃圾收取費＄600，由承租人負擔,RPSPMLOJJHHGFBA27CC
大同區,建物,臺北市大同區南京西路３４０號,0.0,商,,,1101215,土地0建物0車位0,四層,4,套房(1房1廳1衛),,加強磚造,,24.63,1,0,1,有,無,有,11800,479,,0.0,0,此為分租套房，第4層共分成5間，一間平均面積約為24.63平方公尺。每月水雜費＄200，垃圾收取費＄600，由承租人負擔,RPTPMLOJJHHGFBA37CC
萬華區,建物,臺北市萬華區和平西路三段６４號,0.0,商,,,1101216,土地0建物0車位0,四層,5,套房(1房1廳1衛),住商用,鋼筋混凝土造,,21.89,1,0,1,有,無,有,10700,489,,0.0,0,此為分租套房，第4層共分成5間，一間平均面積約為21.89平方公尺。每月水雜費＄200，垃圾收取費＄600，公區使用費＄1500，由承租人負擔,RPUPMLOJJHHGFBA47CC
北投區,建物,臺北市北投區三合街一段６７號９樓,0.0,住,,,1110103,土地0建物1車位2,九層,9,住宅大樓(11層含以上有電梯),住家用,鋼筋混凝土造,1031119,221.66,3,2,2,有,有,無,92000,415,坡道平面,24.5,0,,RPSNMLOJJHHGFEA37CC
北投區,建物,臺北市北投區知行路５巷１號五樓,0.0,住,,,1101122,土地0建物1車位0,五層,5,華廈(10層含以下有電梯),住家用,鋼筋混凝土造,1060606,39.09,2,1,1,有,無,有,20200,517,,0.0,0,國家住宅及都市更新中心110年社會住宅包租代管第三期計畫,RPUNMLOJJHHGFEA57CC
北投區,建物,臺北市北投區大業路２８０巷３５弄１６號五樓之１,0.0,住,,,1101228,土地0建物1車位0,五層,9,華廈(10層含以下有電梯),住家用,鋼筋混凝土造,0850517,48.62,2,2,1,有,有,有,18000,370,,0.0,0,含增建或未登記建物。；租金含管理費。,RPVNMLOJJHHGFEA67CC
士林區,建物,臺北市士林區仰德大道一段６巷８５號,0.0,住,,,1101218,土地0建物0車位0,一層,1,公寓(5樓含以下無電梯),住家用,磚造,0520201,6.68,1,0,0,有,無,有,3200,479,,0.0,0,此為雅房，第1層共分成6間，一間平均面積約為6.68平方公尺。每月水雜費＄200，由承租人負擔,RPWNMLOJJHHGFEA77CC
北投區,房地(土地+建物),臺北市北投區中和街２８號九樓之６,8.65,其他,,,1101118,土地4建物1車位0,九層,17,住宅大樓(11層含以上有電梯),商業用,鋼筋混凝土造,0890329,70.9,2,2,1,有,有,有,23000,324,,0.0,0,,RPXNMLOJJHHGFEA87CC
士林區,建物,臺北市士林區福港街２１４號四樓,0.0,住,,,1101213,土地0建物1車位0,四層,4,公寓(5樓含以下無電梯),住家用,鋼筋混凝土造,0670302,76.57,3,2,1,有,無,有,25000,326,,0.0,0,,RPPOMLOJJHHGFEA17CC
北投區,建物,臺北市北投區文林北路７５巷６７號二樓,0.0,住,,,1101117,土地0建物1車位1,二層,13,住宅大樓(11層含以上有電梯),Ｈ２多戶住宅,鋼筋混凝土造,1061117,191.64,3,2,2,有,有,無,35000,183,坡道平面,43.1,0,,RPVOMLOJJHHGFEA77CC
北投區,建物,臺北市北投區東華街一段４９８號十樓,0.0,住,,,1101226,土地0建物1車位3,十層,14,住宅大樓(11層含以上有電梯),住家用,鋼筋混凝土造,0950720,321.85,4,2,2,有,有,有,150000,466,坡道平面,109.84,0,租金含管理費。,RPPPMLOJJHHGFEA27CC
士林區,建物,臺北市士林區中山北路六段１９５巷８號六樓之１,0.0,住,,,1101231,土地0建物1車位0,六層,14,住宅大樓(11層含以上有電梯),住家用,鋼筋混凝土造,0970506,142.22,3,2,2,有,有,有,67000,471,,0.0,0,續租。；,RPQPMLOJJHHGFEA37CC
大安區,建物,臺北市大安區光復南路７２巷２３弄１２號二樓,0.0,住,,,1101228,土地0建物1車位0,二層,4,公寓(5樓含以下無電梯),住家用,鋼筋混凝土造,0660602,97.3,3,2,2,有,無,有,28000,288,,0.0,0,,RPUOMLOJJHHGFFA77CC
大安區,建物,臺北市大安區大安路一段２０４號１２樓之２,0.0,住,,,1101229,土地0建物1車位0,十二層,12,住宅大樓(11層含以上有電梯),住家用,鋼筋混凝土造,0971028,32.07,1,1,1,有,無,有,25945,809,,0.0,0,,RPVOMLOJJHHGFFA87CC
中正區,建物,臺北市中正區中華路二段７５巷１弄５號１樓,0.0,商,,,1101217,土地0建物1車位0,一層,4,公寓(5樓含以下無電梯),住商用,鋼筋混凝土造,,75.6,0,0,0,無,無,無,33000,437,,0.0,0,,RPRNMLOJJHHGFAA86CC
文山區,建物,臺北市文山區萬隆街１５之２號三樓,0.0,住,,,1101228,土地0建物1車位0,見其他登記事項,4,公寓(5樓含以下無電梯),住家用,鋼筋混凝土造,0620720,102.04,3,2,1,有,無,有,24000,235,,0.0,0,,RPUNMLOJJHHGFAA17CC
文山區,建物,臺北市文山區景興路２０２巷１１號十樓之１,0.0,商,,,1101217,土地0建物1車位0,十層,16,住宅大樓(11層含以上有電梯),商業用,鋼筋混凝土造,0811006,74.73,2,1,1,有,有,有,25000,335,,0.0,0,含增建或未登記建物。；租金含管理費。,RPWNMLOJJHHGFAA37CC
大安區,建物,臺北市大安區光復南路６０８號１樓，２樓,90.97,商,,,1101213,土地0建物2車位0,見其他登記事項,4,公寓(5樓含以下無電梯),住商用,鋼筋混凝土造,,127.26,0,0,0,無,無,有,68000,534,,0.0,0,,RPQNMLOJJHHGFFA37DC
內湖區,建物,臺北市內湖區環山路一段１３６巷１２弄８號２樓,0.0,住,,,1101225,土地0建物1車位0,二層,4,公寓(5樓含以下無電梯),住家用,鋼筋混凝土造,0660623,91.33,3,2,1,有,無,有,24000,263,,0.0,0,,RPPPMLOJJHHGFCA07CC
中山區,建物,臺北市中山區長安東路一段２２之１８號１樓,0.0,商,,,1101129,土地0建物1車位0,一層,4,公寓(5樓含以下無電梯),,加強磚造,,60.1,0,0,0,無,無,無,45511,757,,0.0,0,,RPRQMLOJJHHGFCA37CC
中山區,建物,臺北市中山區中山北路二段４４號４樓,0.0,商,,,1101214,土地0建物1車位1,四層,17,辦公商業大樓,商業用,鋼骨鋼筋混凝土造,0800919,229.43,0,0,0,無,有,無,159620,696,坡道平面,0.0,0,部分面積出租,RPXQMLOJJHHGFCA97CC
中山區,建物,臺北市中山區敬業一路１１８號１樓,0.0,商,,,1101229,土地0建物1車位0,一層,7,店面(店鋪),商業用,鋼筋混凝土造,0970131,83.9,0,0,1,有,有,無,50000,596,,0.0,0,,RPORMLOJJHHGFCA17CC
中山區,建物,臺北市中山區南京東路二段１３７號１２樓,0.0,商,,,1101227,土地0建物1車位0,十二層,14,辦公商業大樓,商業用,鋼筋混凝土造,0670810,519.15,0,0,0,無,有,無,329784,635,,0.0,0,部分面積出租、總租金包含大樓管理費用,RPQRMLOJJHHGFCA37CC
中山區,建物,臺北市中山區松江路６４巷２２號６樓,0.0,商,,,1101227,土地0建物1車位0,六層,7,華廈(10層含以下有電梯),住家用,鋼筋混凝土造,1051230,68.63,2,1,1,有,有,有,37000,539,,0.0,0,,RPOSMLOJJHHGFCA27CC
中山區,建物,臺北市中山區吉林路４２８號,0.0,住,,,1101217,土地0建物0車位0,三層,4,套房(1房1廳1衛),住家用,加強磚造,0580410,24.95,1,0,1,有,無,有,12000,481,,0.0,0,此為分租套房，第3層共分成3間，一間平均面積約為24.95平方公尺。每月水雜費＄200，垃圾收取費＄600，由承租人負擔,RPTSMLOJJHHGFCA77CC
中山區,建物,臺北市中山區吉林路４２８號,0.0,住,,,1101220,土地0建物0車位0,二層,4,套房(1房1廳1衛),住家用,加強磚造,0580410,24.95,1,0,1,有,無,有,11600,465,,0.0,0,此為分租套房，第2層共分成3間，一間平均面積約為24.95平方公尺。每月水雜費＄200，垃圾收取費＄600，由承租人負擔,RPVSMLOJJHHGFCA97CC
信義區,房地(土地+建物),臺北市信義區莊敬路３２５巷２３號１樓,32.59,住,,,1101208,土地1建物1車位0,見其他登記事項,7,華廈(10層含以下有電梯),見使用執照,鋼筋混凝土造,0710721,167.31,0,0,0,無,無,無,58000,347,,0.0,0,,RPROMLOJJHHGFDA27CC
南港區,建物,臺北市南港區研究院路二段６１巷１７號四樓之２,0.0,其他,,,1101224,土地0建物1車位1,四層,18,住宅大樓(11層含以上有電梯),住家用,鋼筋混凝土造,1021230,207.31,3,2,2,有,有,有,52000,251,坡道平面,51.95,0,租金含管理費。,RPSPMLOJJHHGFDA47CC
信義區,房地(土地+建物),臺北市信義區基隆路二段１８９號４樓之８,0.0,商,,,1101228,土地1建物1車位0,四層,,辦公商業大樓,,,,50.97,1,1,0,有,有,有,25000,490,,0.0,0,,RPPNMLPJJHHGFDA07CC
松山區,建物,臺北市松山區八德路四段６９號,0.0,住,,,1101231,土地0建物1車位0,一層,4,店面(店鋪),工業用,鋼筋混凝土造,0620926,98.92,0,0,1,有,無,有,57000,576,,0.0,0,,RPSNMLPJJHHGFDA37CC
松山區,建物,臺北市松山區南京東路四段１３３巷７弄２５號４樓,0.0,住,,,1101208,土地0建物1車位0,四層,4,公寓(5樓含以下無電梯),住家用,鋼筋混凝土造,0510331,99.68,3,1,1,有,無,有,26000,261,,0.0,0,租賃範圍不含車位，且無法區分車位面積。；續租。；,RPOOMLPJJHHGFDA07CC
信義區,建物,臺北市信義區忠孝東路五段３７２巷２７弄２１號５樓,0.0,住,,,1101202,土地0建物1車位0,五層,7,華廈(10層含以下有電梯),住家用,鋼筋混凝土造,0731228,83.63,2,2,1,有,有,有,27500,329,,0.0,0,租賃範圍不含車位，且無法區分車位面積。；,RPQOMLPJJHHGFDA27CC
信義區,建物,臺北市信義區永吉路１２０巷４７號３樓,0.0,住,,,1101209,土地0建物1車位0,三層,4,公寓(5樓含以下無電梯),住家用,加強磚造,0590806,112.74,3,1,1,有,無,有,25000,222,,0.0,0,租賃範圍不含車位，且無法區分車位面積。；,RPROMLPJJHHGFDA37CC
松山區,建物,臺北市松山區八德路四段６０２號６樓之３,0.0,商,,,1101125,土地0建物1車位0,六層,12,住宅大樓(11層含以上有電梯),住家用,鋼筋混凝土造,0770816,128.91,3,2,2,有,無,有,33500,260,,0.0,0,租賃範圍不含車位，且無法區分車位面積。；,RPTOMLPJJHHGFDA57CC
信義區,房地(土地+建物)+車位,臺北市信義區松仁路１５３巷１２號９樓,125.19,住,,,1101126,土地1建物1車位1,九層,9,住宅大樓(11層含以上有電梯),住家用,鋼筋混凝土造,0850122,526.65,2,2,3,有,有,有,157500,299,坡道平面,0.0,0,,RPPSMLPJJHHGFDA57CC
中山區,建物,臺北市中山區民生東路二段５８號,0.0,商,,,1101208,土地0建物1車位0,一層,2,店面(店鋪),,加強磚造,,179.96,0,0,0,無,無,有,65000,361,,0.0,0,,RPRNMLPJJHHGFCA17CC
中山區,建物,臺北市中山區中山北路二段６５巷４１號二樓,0.0,商,,,1101230,土地0建物1車位0,二層,4,公寓(5樓含以下無電梯),住家用,鋼筋混凝土造,0620613,131.81,0,0,0,無,無,無,35000,266,,0.0,0,水電費瓦斯費由承租人負擔,RPUNMLPJJHHGFCA47CC
中山區,建物,臺北市中山區德惠街５２號７樓之１５,0.0,商,,,1101227,土地0建物1車位0,七層,11,套房(1房1廳1衛),住家用,鋼筋混凝土造,0710227,29.55,1,1,1,有,有,有,13500,457,,0.0,0,,RPROMLPJJHHGFCA27CC
